{
  "video_id": "3SRyslGSMW4",
  "youtube_url": "https://www.youtube.com/watch?v=3SRyslGSMW4",
  "channel_id": "UC4SVo0Ue36XCfOyb5Lh1viQ",
  "title": "Aggregation in Pandas is easy! \u2795",
  "publish_date": "2025-09-09",
  "duration_seconds": 468,
  "language": "en-US",
  "playable_in_embed": true,
  "caption_tracks": [
    {
      "lang": "en-orig",
      "kind": "auto"
    },
    {
      "lang": "en",
      "kind": "auto"
    }
  ],
  "chapters": [
    {
      "title": "Introduction and basics",
      "start_seconds": 0,
      "end_seconds": 178
    },
    {
      "title": "Single column aggregation",
      "start_seconds": 178,
      "end_seconds": 286
    },
    {
      "title": "Grouping data",
      "start_seconds": 286,
      "end_seconds": 468
    }
  ],
  "thumbnail_urls": [
    "https://i.ytimg.com/vi_webp/3SRyslGSMW4/maxresdefault.webp"
  ],
  "transcript_available": true,
  "fetched_at": "2026-10-02T05:56:16.644056+00:00",
  "fetch_tool": "yt-dlp 2026.08.19",
  "judged_ranges": []
}