{
  "video_id": "ETQXKwM6YMY",
  "youtube_url": "https://www.youtube.com/watch?v=ETQXKwM6YMY",
  "channel_id": "UCBqMxo5ch1NN0hZsM58gf6Q",
  "title": "Pivot tables with Pandas",
  "publish_date": "2022-03-10",
  "duration_seconds": 539,
  "language": "en-US",
  "playable_in_embed": true,
  "caption_tracks": [
    {
      "lang": "en-orig",
      "kind": "auto"
    },
    {
      "lang": "en",
      "kind": "auto"
    }
  ],
  "chapters": [],
  "thumbnail_urls": [
    "https://i.ytimg.com/vi/ETQXKwM6YMY/hq720.jpg"
  ],
  "transcript_available": true,
  "fetched_at": "2026-10-02T06:01:29.210292+00:00",
  "fetch_tool": "yt-dlp 2026.08.19",
  "judged_ranges": [
    {
      "concept_id": "pandas.pivot_table_reshaping",
      "start_seconds": 172,
      "end_seconds": 475,
      "verdict": "approved",
      "batch_id": "glossary_batch_001_data_analyst_pilot"
    }
  ]
}