{
  "video_id": "cB5koQvGwsA",
  "youtube_url": "https://www.youtube.com/watch?v=cB5koQvGwsA",
  "channel_id": "UCSxX7Vgyu9iThxPE1jSDFdw",
  "title": "Excel Filters Training - Part 1 of 3",
  "publish_date": "2016-11-17",
  "duration_seconds": 968,
  "language": "en-US",
  "playable_in_embed": true,
  "caption_tracks": [
    {
      "lang": "en-orig",
      "kind": "auto"
    },
    {
      "lang": "en",
      "kind": "auto"
    }
  ],
  "chapters": [
    {
      "title": "Introduction to filters",
      "start_seconds": 0,
      "end_seconds": 78
    },
    {
      "title": "Applying basic filters",
      "start_seconds": 78,
      "end_seconds": 378
    },
    {
      "title": "Using excel tables",
      "start_seconds": 378,
      "end_seconds": 654
    },
    {
      "title": "Navigation shortcuts",
      "start_seconds": 654,
      "end_seconds": 968
    }
  ],
  "thumbnail_urls": [
    "https://i.ytimg.com/vi_webp/cB5koQvGwsA/maxresdefault.webp"
  ],
  "transcript_available": true,
  "fetched_at": "2026-10-02T06:18:58.103568+00:00",
  "fetch_tool": "yt-dlp 2026.08.19",
  "judged_ranges": []
}