{
  "video_id": "t9j8lCUGZXo",
  "youtube_url": "https://www.youtube.com/watch?v=t9j8lCUGZXo",
  "channel_id": "UCWv7vMbMWH4-V0ZXdmDpPBA",
  "title": "What are Sets in Python? Python Tutorial for Absolute Beginners | Mosh",
  "publish_date": "2018-11-14",
  "duration_seconds": 270,
  "language": "en",
  "playable_in_embed": true,
  "caption_tracks": [
    {
      "lang": "en-orig",
      "kind": "auto"
    },
    {
      "lang": "en",
      "kind": "auto"
    }
  ],
  "chapters": [
    {
      "title": "Introduction",
      "start_seconds": 0,
      "end_seconds": 18
    },
    {
      "title": "Sets",
      "start_seconds": 18,
      "end_seconds": 89
    },
    {
      "title": "Union",
      "start_seconds": 89,
      "end_seconds": 270
    }
  ],
  "thumbnail_urls": [
    "https://i.ytimg.com/vi_webp/t9j8lCUGZXo/maxresdefault.webp"
  ],
  "transcript_available": true,
  "fetched_at": "2026-10-02T06:26:04.419409+00:00",
  "fetch_tool": "yt-dlp 2026.08.19",
  "judged_ranges": [
    {
      "concept_id": "python.sets",
      "start_seconds": 2,
      "end_seconds": 243,
      "verdict": "approved",
      "batch_id": "glossary_batch_001_data_analyst_pilot"
    }
  ]
}