{
  "video_id": "ZjMTZIxgkYo",
  "youtube_url": "https://www.youtube.com/watch?v=ZjMTZIxgkYo",
  "channel_id": "UCpNUYWW0kiqyh0j5Qy3aU7w",
  "title": "Extract Hour, Day, Month Info from Pandas DateTime",
  "publish_date": "2024-04-17",
  "duration_seconds": 269,
  "language": "en-US",
  "playable_in_embed": true,
  "caption_tracks": [
    {
      "lang": "en-orig",
      "kind": "auto"
    },
    {
      "lang": "en",
      "kind": "auto"
    }
  ],
  "chapters": [],
  "thumbnail_urls": [
    "https://i.ytimg.com/vi/ZjMTZIxgkYo/maxresdefault.jpg"
  ],
  "transcript_available": true,
  "fetched_at": "2026-10-02T06:16:29.091130+00:00",
  "fetch_tool": "yt-dlp 2026.08.19",
  "judged_ranges": []
}