{
  "video_id": "hY-LtLLGDos",
  "youtube_url": "https://www.youtube.com/watch?v=hY-LtLLGDos",
  "channel_id": "UCdHC62kngffvzsuHofvqCBg",
  "title": "Convert Column Data Types in Pandas   Python",
  "publish_date": "2021-05-09",
  "duration_seconds": 284,
  "language": "en",
  "playable_in_embed": true,
  "caption_tracks": [
    {
      "lang": "en",
      "kind": "creator"
    },
    {
      "lang": "pt-BR",
      "kind": "creator"
    },
    {
      "lang": "es",
      "kind": "creator"
    },
    {
      "lang": "en-orig",
      "kind": "auto"
    },
    {
      "lang": "en",
      "kind": "auto"
    }
  ],
  "chapters": [
    {
      "title": "<Untitled Chapter 1>",
      "start_seconds": 0,
      "end_seconds": 23
    },
    {
      "title": "Introduction",
      "start_seconds": 23,
      "end_seconds": 84
    },
    {
      "title": "Create Sample Data with integers Frame and Sorting",
      "start_seconds": 84,
      "end_seconds": 133
    },
    {
      "title": "Replacing Some elements to integers prevents sorting",
      "start_seconds": 133,
      "end_seconds": 175
    },
    {
      "title": "Changing type of single columns",
      "start_seconds": 175,
      "end_seconds": 205
    },
    {
      "title": "Changing Type of entire data frames",
      "start_seconds": 205,
      "end_seconds": 230
    },
    {
      "title": "Changing type of multiple pandas data frame columns using slicing",
      "start_seconds": 230,
      "end_seconds": 284
    }
  ],
  "thumbnail_urls": [
    "https://i.ytimg.com/vi_webp/hY-LtLLGDos/maxresdefault.webp"
  ],
  "transcript_available": true,
  "fetched_at": "2026-10-02T06:21:11.141446+00:00",
  "fetch_tool": "yt-dlp 2026.08.19",
  "judged_ranges": [
    {
      "concept_id": "pandas.dtype_conversion",
      "start_seconds": 80,
      "end_seconds": 200,
      "verdict": "approved",
      "batch_id": "glossary_batch_001_data_analyst_pilot"
    }
  ]
}