{
  "video_id": "4MVNjzsGokc",
  "youtube_url": "https://www.youtube.com/watch?v=4MVNjzsGokc",
  "channel_id": "UC8uU_wruBMHeeRma49dtZKA",
  "title": "How to use Excel formula references - A1 vs. $A$1 vs $A1 vs A$1 explained",
  "publish_date": "2021-09-07",
  "duration_seconds": 629,
  "language": "en-US",
  "playable_in_embed": true,
  "caption_tracks": [
    {
      "lang": "en-orig",
      "kind": "auto"
    },
    {
      "lang": "en",
      "kind": "auto"
    }
  ],
  "chapters": [
    {
      "title": "Introduction to Excel reference styles (relative)",
      "start_seconds": 0,
      "end_seconds": 93
    },
    {
      "title": "How to make a reference Absolute",
      "start_seconds": 93,
      "end_seconds": 140
    },
    {
      "title": "Cell reference used in business situation - Example",
      "start_seconds": 140,
      "end_seconds": 229
    },
    {
      "title": "Using Mixed Reference style (A$1, $A1)",
      "start_seconds": 229,
      "end_seconds": 306
    },
    {
      "title": "Using Absolute Reference ($A$1)",
      "start_seconds": 306,
      "end_seconds": 417
    },
    {
      "title": "Using Reference Style in a Range ($A$1:A1) - IMPORTANT TIP",
      "start_seconds": 417,
      "end_seconds": 490
    },
    {
      "title": "Structural References",
      "start_seconds": 490,
      "end_seconds": 595
    },
    {
      "title": "Closing Remarks",
      "start_seconds": 595,
      "end_seconds": 629
    }
  ],
  "thumbnail_urls": [
    "https://i.ytimg.com/vi/4MVNjzsGokc/maxresdefault.jpg"
  ],
  "transcript_available": true,
  "fetched_at": "2026-10-02T05:56:56.182775+00:00",
  "fetch_tool": "yt-dlp 2026.08.19",
  "judged_ranges": []
}