{
  "video_id": "rToJbe2wcnY",
  "youtube_url": "https://www.youtube.com/watch?v=rToJbe2wcnY",
  "channel_id": "UCiYjpuUaSfkvdZkmtDU7JRw",
  "title": "Excel for Beginners - Working with Cells, Rows & Columns including Pro Tips!",
  "publish_date": "2020-08-08",
  "duration_seconds": 310,
  "language": "en-US",
  "playable_in_embed": true,
  "caption_tracks": [
    {
      "lang": "en-orig",
      "kind": "auto"
    },
    {
      "lang": "en",
      "kind": "auto"
    }
  ],
  "chapters": [
    {
      "title": "Intro",
      "start_seconds": 0,
      "end_seconds": 9
    },
    {
      "title": "Adjust cell height and width",
      "start_seconds": 9,
      "end_seconds": 62
    },
    {
      "title": "Format multiple rows and columns",
      "start_seconds": 62,
      "end_seconds": 75
    },
    {
      "title": "Auto fit",
      "start_seconds": 75,
      "end_seconds": 147
    },
    {
      "title": "Insert",
      "start_seconds": 147,
      "end_seconds": 190
    },
    {
      "title": "Shortcut Keys",
      "start_seconds": 190,
      "end_seconds": 207
    },
    {
      "title": "Select Rows",
      "start_seconds": 207,
      "end_seconds": 266
    },
    {
      "title": "Unhide Rows",
      "start_seconds": 266,
      "end_seconds": 310
    }
  ],
  "thumbnail_urls": [
    "https://i.ytimg.com/vi_webp/rToJbe2wcnY/maxresdefault.webp"
  ],
  "transcript_available": true,
  "fetched_at": "2026-10-02T06:25:00.593838+00:00",
  "fetch_tool": "yt-dlp 2026.08.19",
  "judged_ranges": []
}