{
  "video_id": "VgBxnayDXk0",
  "youtube_url": "https://www.youtube.com/watch?v=VgBxnayDXk0",
  "channel_id": "UCSxX7Vgyu9iThxPE1jSDFdw",
  "title": "Excel Pie Chart Tutorial + Common Mistakes to Avoid",
  "publish_date": "2023-11-02",
  "duration_seconds": 662,
  "language": "en-US",
  "playable_in_embed": true,
  "caption_tracks": [
    {
      "lang": "en-orig",
      "kind": "auto"
    },
    {
      "lang": "en",
      "kind": "auto"
    }
  ],
  "chapters": [
    {
      "title": "Introduction",
      "start_seconds": 0,
      "end_seconds": 38
    },
    {
      "title": "What is a Pie Chart?",
      "start_seconds": 38,
      "end_seconds": 84
    },
    {
      "title": "Two Types of Pie Charts",
      "start_seconds": 84,
      "end_seconds": 199
    },
    {
      "title": "Too many slices",
      "start_seconds": 199,
      "end_seconds": 263
    },
    {
      "title": "When Rank Matters",
      "start_seconds": 263,
      "end_seconds": 310
    },
    {
      "title": "Panel Charts",
      "start_seconds": 310,
      "end_seconds": 337
    },
    {
      "title": "Pie Vs Bar os Line Charts",
      "start_seconds": 337,
      "end_seconds": 362
    },
    {
      "title": "Avoid the Legend",
      "start_seconds": 362,
      "end_seconds": 417
    },
    {
      "title": "Too Many Colors & Labels",
      "start_seconds": 417,
      "end_seconds": 497
    },
    {
      "title": "3D Exploding Pie Charts",
      "start_seconds": 497,
      "end_seconds": 569
    },
    {
      "title": "Quiz Time",
      "start_seconds": 569,
      "end_seconds": 662
    }
  ],
  "thumbnail_urls": [
    "https://i.ytimg.com/vi/VgBxnayDXk0/maxresdefault.jpg"
  ],
  "transcript_available": true,
  "fetched_at": "2026-10-02T06:11:52.308516+00:00",
  "fetch_tool": "yt-dlp 2026.08.19",
  "judged_ranges": []
}