{
  "video_id": "aoNRYtVEhAM",
  "youtube_url": "https://www.youtube.com/watch?v=aoNRYtVEhAM",
  "channel_id": "UC4SVo0Ue36XCfOyb5Lh1viQ",
  "title": "Selection in Pandas is easy! \ud83c\udfaf",
  "publish_date": "2025-09-06",
  "duration_seconds": 553,
  "language": "en-US",
  "playable_in_embed": true,
  "caption_tracks": [
    {
      "lang": "en-orig",
      "kind": "auto"
    },
    {
      "lang": "en",
      "kind": "auto"
    }
  ],
  "chapters": [
    {
      "title": "Column selection techniques",
      "start_seconds": 0,
      "end_seconds": 162
    },
    {
      "title": "Row selection and filtering",
      "start_seconds": 162,
      "end_seconds": 439
    },
    {
      "title": "Interactive pokemon search",
      "start_seconds": 439,
      "end_seconds": 553
    }
  ],
  "thumbnail_urls": [
    "https://i.ytimg.com/vi_webp/aoNRYtVEhAM/maxresdefault.webp"
  ],
  "transcript_available": true,
  "fetched_at": "2026-10-02T06:18:09.721843+00:00",
  "fetch_tool": "yt-dlp 2026.08.19",
  "judged_ranges": [
    {
      "concept_id": "pandas.loc_iloc_selection",
      "start_seconds": 163,
      "end_seconds": 438,
      "verdict": "approved",
      "batch_id": "glossary_batch_001_data_analyst_pilot"
    }
  ]
}