{
  "video_id": "W6WFX_H-AA4",
  "youtube_url": "https://www.youtube.com/watch?v=W6WFX_H-AA4",
  "channel_id": "UC4SVo0Ue36XCfOyb5Lh1viQ",
  "title": "Series in Pandas are easy! 1\ufe0f\u20e3",
  "publish_date": "2025-09-03",
  "duration_seconds": 647,
  "language": "en-US",
  "playable_in_embed": true,
  "caption_tracks": [
    {
      "lang": "en-orig",
      "kind": "auto"
    },
    {
      "lang": "en",
      "kind": "auto"
    }
  ],
  "chapters": [
    {
      "title": "Introduction to pandas series",
      "start_seconds": 0,
      "end_seconds": 27
    },
    {
      "title": "Creating a series object",
      "start_seconds": 27,
      "end_seconds": 151
    },
    {
      "title": "Customizing the index",
      "start_seconds": 151,
      "end_seconds": 225
    },
    {
      "title": "Accessing and updating data",
      "start_seconds": 225,
      "end_seconds": 337
    },
    {
      "title": "Filtering series data",
      "start_seconds": 337,
      "end_seconds": 404
    },
    {
      "title": "Creating a series from a dict",
      "start_seconds": 404,
      "end_seconds": 578
    },
    {
      "title": "Filtering and conclusion",
      "start_seconds": 578,
      "end_seconds": 647
    }
  ],
  "thumbnail_urls": [
    "https://i.ytimg.com/vi_webp/W6WFX_H-AA4/maxresdefault.webp"
  ],
  "transcript_available": true,
  "fetched_at": "2026-10-02T06:12:20.920607+00:00",
  "fetch_tool": "yt-dlp 2026.08.19",
  "judged_ranges": [
    {
      "concept_id": "pandas.dataframe_series_model",
      "start_seconds": 0,
      "end_seconds": 161,
      "verdict": "approved",
      "batch_id": "glossary_batch_001_data_analyst_pilot"
    }
  ]
}