{
  "video_id": "dlBuWllegRg",
  "youtube_url": "https://www.youtube.com/watch?v=dlBuWllegRg",
  "channel_id": "UC8uU_wruBMHeeRma49dtZKA",
  "title": "XLOOKUP in Excel | Step-by-Step Tutorial for Beginners (better than VLOOKUP)",
  "publish_date": "2025-07-02",
  "duration_seconds": 375,
  "language": "en-US",
  "playable_in_embed": true,
  "caption_tracks": [
    {
      "lang": "en-orig",
      "kind": "auto"
    },
    {
      "lang": "en",
      "kind": "auto"
    }
  ],
  "chapters": [
    {
      "title": "Introduction to XLOOKUP",
      "start_seconds": 0,
      "end_seconds": 64
    },
    {
      "title": "Performing basic lookups",
      "start_seconds": 64,
      "end_seconds": 135
    },
    {
      "title": "Handling lookup errors",
      "start_seconds": 135,
      "end_seconds": 171
    },
    {
      "title": "Finding numeric data",
      "start_seconds": 171,
      "end_seconds": 213
    },
    {
      "title": "Returning full records",
      "start_seconds": 213,
      "end_seconds": 253
    },
    {
      "title": "Lookups across sheets",
      "start_seconds": 253,
      "end_seconds": 375
    }
  ],
  "thumbnail_urls": [
    "https://i.ytimg.com/vi/dlBuWllegRg/maxresdefault.jpg"
  ],
  "transcript_available": true,
  "fetched_at": "2026-10-02T06:19:32.153664+00:00",
  "fetch_tool": "yt-dlp 2026.08.19",
  "judged_ranges": [
    {
      "concept_id": "spreadsheet.vlookup_xlookup",
      "start_seconds": 0,
      "end_seconds": 171,
      "verdict": "approved",
      "batch_id": "glossary_batch_001_data_analyst_pilot"
    }
  ]
}