{
  "video_id": "3Xc3CA655Y4",
  "youtube_url": "https://www.youtube.com/watch?v=3Xc3CA655Y4",
  "channel_id": "UC8butISFwT-Wl7EV0hUK0BQ",
  "title": "Matplotlib Crash Course",
  "publish_date": "2020-05-07",
  "duration_seconds": 5500,
  "language": "en",
  "playable_in_embed": true,
  "caption_tracks": [
    {
      "lang": "en-orig",
      "kind": "auto"
    },
    {
      "lang": "en",
      "kind": "auto"
    }
  ],
  "chapters": [
    {
      "title": "Introduction",
      "start_seconds": 0,
      "end_seconds": 143
    },
    {
      "title": "Creating a basic graph",
      "start_seconds": 143,
      "end_seconds": 275
    },
    {
      "title": "Adding titles and labels",
      "start_seconds": 275,
      "end_seconds": 422
    },
    {
      "title": "Formatting fonts and styles",
      "start_seconds": 422,
      "end_seconds": 529
    },
    {
      "title": "Configuring axis ticks",
      "start_seconds": 529,
      "end_seconds": 662
    },
    {
      "title": "Legends and markers",
      "start_seconds": 662,
      "end_seconds": 941
    },
    {
      "title": "Shorthand plot styling",
      "start_seconds": 941,
      "end_seconds": 1053
    },
    {
      "title": "Adding and plotting multiple lines",
      "start_seconds": 1053,
      "end_seconds": 1314
    },
    {
      "title": "Resizing and saving figures",
      "start_seconds": 1314,
      "end_seconds": 1608
    },
    {
      "title": "Creating bar charts",
      "start_seconds": 1608,
      "end_seconds": 1873
    },
    {
      "title": "Real world examples with pandas",
      "start_seconds": 1873,
      "end_seconds": 3155
    },
    {
      "title": "FIFA data visualization",
      "start_seconds": 3155,
      "end_seconds": 3608
    },
    {
      "title": "Creating pie charts",
      "start_seconds": 3608,
      "end_seconds": 4043
    },
    {
      "title": "Advanced pie chart styling",
      "start_seconds": 4043,
      "end_seconds": 4712
    },
    {
      "title": "Box and whisker plots",
      "start_seconds": 4712,
      "end_seconds": 5500
    }
  ],
  "thumbnail_urls": [
    "https://i.ytimg.com/vi_webp/3Xc3CA655Y4/maxresdefault.webp"
  ],
  "transcript_available": true,
  "fetched_at": "2026-10-02T05:56:33.095271+00:00",
  "fetch_tool": "yt-dlp 2026.08.19",
  "judged_ranges": [
    {
      "concept_id": "viz.box_plots",
      "start_seconds": 4723,
      "end_seconds": 5031,
      "verdict": "rejected_inaccurate",
      "batch_id": "glossary_batch_001_data_analyst_pilot"
    }
  ]
}