{
  "video_id": "afITiFR6vfw",
  "youtube_url": "https://www.youtube.com/watch?v=afITiFR6vfw",
  "channel_id": "UCfzlCWGWYyIQ0aLC5w48gBQ",
  "title": "Matplotlib Tutorial 19 - subplots",
  "publish_date": "2015-07-12",
  "duration_seconds": 757,
  "language": "en",
  "playable_in_embed": true,
  "caption_tracks": [
    {
      "lang": "en-orig",
      "kind": "auto"
    },
    {
      "lang": "en",
      "kind": "auto"
    }
  ],
  "chapters": [
    {
      "title": "<Untitled Chapter 1>",
      "start_seconds": 0,
      "end_seconds": 7
    },
    {
      "title": "Subplots",
      "start_seconds": 7,
      "end_seconds": 35
    },
    {
      "title": "Random Data",
      "start_seconds": 35,
      "end_seconds": 61
    },
    {
      "title": "Function Create Plots",
      "start_seconds": 61,
      "end_seconds": 101
    },
    {
      "title": "Find some Axes",
      "start_seconds": 101,
      "end_seconds": 426
    },
    {
      "title": "Sub Plot to Grid",
      "start_seconds": 426,
      "end_seconds": 527
    },
    {
      "title": "Row Span",
      "start_seconds": 527,
      "end_seconds": 561
    },
    {
      "title": "Subplot to Grid",
      "start_seconds": 561,
      "end_seconds": 605
    },
    {
      "title": "Subplots within the Grid",
      "start_seconds": 605,
      "end_seconds": 757
    }
  ],
  "thumbnail_urls": [
    "https://i.ytimg.com/vi_webp/afITiFR6vfw/maxresdefault.webp"
  ],
  "transcript_available": true,
  "fetched_at": "2026-10-02T06:17:43.993632+00:00",
  "fetch_tool": "yt-dlp 2026.08.19",
  "judged_ranges": []
}