{
  "video_id": "5bwpXLHzZRo",
  "youtube_url": "https://www.youtube.com/watch?v=5bwpXLHzZRo",
  "channel_id": "UCnz-ZXXER4jOvuED5trXfEA",
  "title": "Local and Global Scope in Python | Local and Global Variables | Python Tutorial for Beginners #7",
  "publish_date": "2021-03-01",
  "duration_seconds": 686,
  "language": "en-US",
  "playable_in_embed": true,
  "caption_tracks": [
    {
      "lang": "en-orig",
      "kind": "auto"
    },
    {
      "lang": "en",
      "kind": "auto"
    }
  ],
  "chapters": [
    {
      "title": "Introduction to scopes",
      "start_seconds": 0,
      "end_seconds": 54
    },
    {
      "title": "Understanding scope example",
      "start_seconds": 54,
      "end_seconds": 115
    },
    {
      "title": "Global vs local limitations",
      "start_seconds": 115,
      "end_seconds": 238
    },
    {
      "title": "Scope isolation rules",
      "start_seconds": 238,
      "end_seconds": 320
    },
    {
      "title": "Global variable access",
      "start_seconds": 320,
      "end_seconds": 431
    },
    {
      "title": "Reference before assignment",
      "start_seconds": 431,
      "end_seconds": 509
    },
    {
      "title": "Same variable names",
      "start_seconds": 509,
      "end_seconds": 564
    },
    {
      "title": "Modifying global variables",
      "start_seconds": 564,
      "end_seconds": 686
    }
  ],
  "thumbnail_urls": [
    "https://i.ytimg.com/vi/5bwpXLHzZRo/maxresdefault.jpg"
  ],
  "transcript_available": true,
  "fetched_at": "2026-10-02T05:57:21.211060+00:00",
  "fetch_tool": "yt-dlp 2026.08.19",
  "judged_ranges": []
}