{
  "video_id": "VtVB-XsooiM",
  "youtube_url": "https://www.youtube.com/watch?v=VtVB-XsooiM",
  "channel_id": "UCSxX7Vgyu9iThxPE1jSDFdw",
  "title": "Excel: How To Convert Text To Dates With Text To Columns",
  "publish_date": "2019-08-30",
  "duration_seconds": 348,
  "language": "en-US",
  "playable_in_embed": true,
  "caption_tracks": [
    {
      "lang": "en-orig",
      "kind": "auto"
    },
    {
      "lang": "en",
      "kind": "auto"
    }
  ],
  "chapters": [
    {
      "title": "Introduction",
      "start_seconds": 0,
      "end_seconds": 89
    },
    {
      "title": "Region Settings",
      "start_seconds": 89,
      "end_seconds": 124
    },
    {
      "title": "Text to Columns",
      "start_seconds": 124,
      "end_seconds": 348
    }
  ],
  "thumbnail_urls": [
    "https://i.ytimg.com/vi/VtVB-XsooiM/hq720.jpg"
  ],
  "transcript_available": true,
  "fetched_at": "2026-10-02T06:12:03.606127+00:00",
  "fetch_tool": "yt-dlp 2026.08.19",
  "judged_ranges": [
    {
      "concept_id": "spreadsheet.text_to_columns_split",
      "start_seconds": 124,
      "end_seconds": 247,
      "verdict": "rejected_fact_mismatch",
      "batch_id": "glossary_batch_001_data_analyst_pilot"
    }
  ]
}