{
  "video_id": "tYBOMw7Ob8E",
  "youtube_url": "https://www.youtube.com/watch?v=tYBOMw7Ob8E",
  "channel_id": "UC7cs8q-gJRlGwj4A8OmCmXg",
  "title": "Intermediate SQL Tutorial | Having Clause",
  "publish_date": "2020-04-09",
  "duration_seconds": 211,
  "language": "en-US",
  "playable_in_embed": true,
  "caption_tracks": [
    {
      "lang": "en-orig",
      "kind": "auto"
    },
    {
      "lang": "en",
      "kind": "auto"
    }
  ],
  "chapters": [
    {
      "title": "Introduction to having",
      "start_seconds": 0,
      "end_seconds": 14
    },
    {
      "title": "Setting up the query",
      "start_seconds": 14,
      "end_seconds": 46
    },
    {
      "title": "Using having instead of where",
      "start_seconds": 46,
      "end_seconds": 90
    },
    {
      "title": "Correcting query syntax",
      "start_seconds": 90,
      "end_seconds": 136
    },
    {
      "title": "Average salary example",
      "start_seconds": 136,
      "end_seconds": 211
    }
  ],
  "thumbnail_urls": [
    "https://i.ytimg.com/vi_webp/tYBOMw7Ob8E/maxresdefault.webp"
  ],
  "transcript_available": true,
  "fetched_at": "2026-10-02T06:26:27.162025+00:00",
  "fetch_tool": "yt-dlp 2026.08.19",
  "judged_ranges": []
}