{
  "video_id": "D5R9Iq3KaPI",
  "youtube_url": "https://www.youtube.com/watch?v=D5R9Iq3KaPI",
  "channel_id": "UC8_RSKwbU1OmZWNEoLV1tQg",
  "title": "Python Sets (Visually Explained) | #Python Course 36",
  "publish_date": "2025-12-04",
  "duration_seconds": 1109,
  "language": "en-US",
  "playable_in_embed": true,
  "caption_tracks": [
    {
      "lang": "en-orig",
      "kind": "auto"
    },
    {
      "lang": "en",
      "kind": "auto"
    }
  ],
  "chapters": [
    {
      "title": "Intro",
      "start_seconds": 0,
      "end_seconds": 40
    },
    {
      "title": "What are Sets?",
      "start_seconds": 40,
      "end_seconds": 69
    },
    {
      "title": "4 Characteristics of Sets",
      "start_seconds": 69,
      "end_seconds": 305
    },
    {
      "title": "Set Methods",
      "start_seconds": 305,
      "end_seconds": 522
    },
    {
      "title": "Math Methods",
      "start_seconds": 522,
      "end_seconds": 852
    },
    {
      "title": "Relationship Methods",
      "start_seconds": 852,
      "end_seconds": 889
    },
    {
      "title": "Recap Sets",
      "start_seconds": 889,
      "end_seconds": 1109
    }
  ],
  "thumbnail_urls": [
    "https://i.ytimg.com/vi_webp/D5R9Iq3KaPI/maxresdefault.webp"
  ],
  "transcript_available": true,
  "fetched_at": "2026-10-02T06:00:46.255784+00:00",
  "fetch_tool": "yt-dlp 2026.08.19",
  "judged_ranges": [
    {
      "concept_id": "python.sets",
      "start_seconds": 526,
      "end_seconds": 693,
      "verdict": "approved",
      "batch_id": "glossary_batch_001_data_analyst_pilot"
    }
  ]
}