{
  "video_id": "UFuo7EHI8zc",
  "youtube_url": "https://www.youtube.com/watch?v=UFuo7EHI8zc",
  "channel_id": "UCCezIgC97PvUuR4_gbFUs5g",
  "title": "Python Pandas Tutorial (Part 10): Working with Dates and Time Series Data",
  "publish_date": "2020-03-17",
  "duration_seconds": 2140,
  "language": "en-US",
  "playable_in_embed": true,
  "caption_tracks": [
    {
      "lang": "en-orig",
      "kind": "auto"
    },
    {
      "lang": "en",
      "kind": "auto"
    }
  ],
  "chapters": [
    {
      "title": "Intro",
      "start_seconds": 0,
      "end_seconds": 170
    },
    {
      "title": "DateTime",
      "start_seconds": 170,
      "end_seconds": 215
    },
    {
      "title": "Convert to DateTime",
      "start_seconds": 215,
      "end_seconds": 282
    },
    {
      "title": "Parse DateTime",
      "start_seconds": 282,
      "end_seconds": 426
    },
    {
      "title": "Run DateTime",
      "start_seconds": 426,
      "end_seconds": 475
    },
    {
      "title": "Parse Dates",
      "start_seconds": 475,
      "end_seconds": 545
    },
    {
      "title": "lambda function",
      "start_seconds": 545,
      "end_seconds": 660
    },
    {
      "title": "run datetime method on series",
      "start_seconds": 660,
      "end_seconds": 721
    },
    {
      "title": "DT class on series",
      "start_seconds": 721,
      "end_seconds": 770
    },
    {
      "title": "Exploring the data",
      "start_seconds": 770,
      "end_seconds": 815
    },
    {
      "title": "Viewing the most recent date",
      "start_seconds": 815,
      "end_seconds": 838
    },
    {
      "title": "Time Delta",
      "start_seconds": 838,
      "end_seconds": 867
    },
    {
      "title": "Filtering by Date",
      "start_seconds": 867,
      "end_seconds": 1053
    },
    {
      "title": "Filtering by Month and Day",
      "start_seconds": 1053,
      "end_seconds": 1099
    },
    {
      "title": "Setting the Index",
      "start_seconds": 1099,
      "end_seconds": 1142
    },
    {
      "title": "Testing the Index",
      "start_seconds": 1142,
      "end_seconds": 1158
    },
    {
      "title": "Filtering the Index",
      "start_seconds": 1158,
      "end_seconds": 1196
    },
    {
      "title": "Using Slices",
      "start_seconds": 1196,
      "end_seconds": 1239
    },
    {
      "title": "Analyzing Slices",
      "start_seconds": 1239,
      "end_seconds": 1288
    },
    {
      "title": "Daily Viewing",
      "start_seconds": 1288,
      "end_seconds": 1336
    },
    {
      "title": "Single Day Viewing",
      "start_seconds": 1336,
      "end_seconds": 1369
    },
    {
      "title": "Max Day Viewing",
      "start_seconds": 1369,
      "end_seconds": 1391
    },
    {
      "title": "Resampling",
      "start_seconds": 1391,
      "end_seconds": 1440
    },
    {
      "title": "Resampling Series",
      "start_seconds": 1440,
      "end_seconds": 1524
    },
    {
      "title": "Saving Series",
      "start_seconds": 1524,
      "end_seconds": 1632
    },
    {
      "title": "Installing Matplotlib",
      "start_seconds": 1632,
      "end_seconds": 1689
    },
    {
      "title": "Resample Multiple Columns",
      "start_seconds": 1689,
      "end_seconds": 1708
    },
    {
      "title": "Resample by Day",
      "start_seconds": 1708,
      "end_seconds": 1755
    },
    {
      "title": "Resample by Week",
      "start_seconds": 1755,
      "end_seconds": 1794
    },
    {
      "title": "Resample by Column",
      "start_seconds": 1794,
      "end_seconds": 1957
    },
    {
      "title": "Summary",
      "start_seconds": 1957,
      "end_seconds": 2004
    },
    {
      "title": "Brilliant",
      "start_seconds": 2004,
      "end_seconds": 2059
    },
    {
      "title": "Outro",
      "start_seconds": 2059,
      "end_seconds": 2140
    }
  ],
  "thumbnail_urls": [
    "https://i.ytimg.com/vi/UFuo7EHI8zc/maxresdefault.jpg"
  ],
  "transcript_available": true,
  "fetched_at": "2026-10-02T06:10:08.220887+00:00",
  "fetch_tool": "yt-dlp 2026.08.19",
  "judged_ranges": [
    {
      "concept_id": "pandas.datetime_handling",
      "start_seconds": 137,
      "end_seconds": 456,
      "verdict": "approved",
      "batch_id": "glossary_batch_001_data_analyst_pilot"
    }
  ]
}