{
  "video_id": "K3KqOTdypyw",
  "youtube_url": "https://www.youtube.com/watch?v=K3KqOTdypyw",
  "channel_id": "UCiYjpuUaSfkvdZkmtDU7JRw",
  "title": "Excel PivotTables Made Easy in 2026 (+ What's Changed!)",
  "publish_date": "2026-03-17",
  "duration_seconds": 1006,
  "language": "en-US",
  "playable_in_embed": true,
  "caption_tracks": [
    {
      "lang": "en-GB",
      "kind": "creator"
    },
    {
      "lang": "en-orig",
      "kind": "auto"
    },
    {
      "lang": "en",
      "kind": "auto"
    }
  ],
  "chapters": [
    {
      "title": "Why PivotTables are so special",
      "start_seconds": 0,
      "end_seconds": 36
    },
    {
      "title": "How to create a PivotTable (AVOID this mistake)",
      "start_seconds": 36,
      "end_seconds": 277
    },
    {
      "title": "To to make changes in a PivotTable",
      "start_seconds": 277,
      "end_seconds": 299
    },
    {
      "title": "What you can automatically do with values",
      "start_seconds": 299,
      "end_seconds": 352
    },
    {
      "title": "How to change a layout of a PivotTable",
      "start_seconds": 352,
      "end_seconds": 371
    },
    {
      "title": "If you don't know where to start with a PivotTable (AI alternatives)",
      "start_seconds": 371,
      "end_seconds": 501
    },
    {
      "title": "Dashboards is the next step you need",
      "start_seconds": 501,
      "end_seconds": 514
    },
    {
      "title": "PivotTable trick many users don't know about",
      "start_seconds": 514,
      "end_seconds": 600
    },
    {
      "title": "Two features will make your PivotTables more powerful",
      "start_seconds": 600,
      "end_seconds": 733
    },
    {
      "title": "Useful trick for slicers",
      "start_seconds": 733,
      "end_seconds": 772
    },
    {
      "title": "How to update a PivotTable if the data changes",
      "start_seconds": 772,
      "end_seconds": 842
    },
    {
      "title": "Mistakes that make PivotTables difficult",
      "start_seconds": 842,
      "end_seconds": 996
    },
    {
      "title": "The next MUST have tool in your arsenal",
      "start_seconds": 996,
      "end_seconds": 1006
    }
  ],
  "thumbnail_urls": [
    "https://i.ytimg.com/vi_webp/K3KqOTdypyw/maxresdefault.webp"
  ],
  "transcript_available": true,
  "fetched_at": "2026-10-02T06:03:46.976848+00:00",
  "fetch_tool": "yt-dlp 2026.08.19",
  "judged_ranges": []
}