{
  "video_id": "Ck0QgwiCEIs",
  "youtube_url": "https://www.youtube.com/watch?v=Ck0QgwiCEIs",
  "channel_id": "UC4SVo0Ue36XCfOyb5Lh1viQ",
  "title": "Data cleaning in Pandas is easy! \ud83e\uddf9",
  "publish_date": "2025-09-10",
  "duration_seconds": 537,
  "language": "en-US",
  "playable_in_embed": true,
  "caption_tracks": [
    {
      "lang": "en-orig",
      "kind": "auto"
    },
    {
      "lang": "en",
      "kind": "auto"
    }
  ],
  "chapters": [
    {
      "title": "Introduction to data cleaning",
      "start_seconds": 0,
      "end_seconds": 24
    },
    {
      "title": "Dropping irrelevant columns",
      "start_seconds": 24,
      "end_seconds": 78
    },
    {
      "title": "Handling missing data",
      "start_seconds": 78,
      "end_seconds": 161
    },
    {
      "title": "Replacing missing values",
      "start_seconds": 161,
      "end_seconds": 224
    },
    {
      "title": "Fixing inconsistent values",
      "start_seconds": 224,
      "end_seconds": 341
    },
    {
      "title": "Standardizing text",
      "start_seconds": 341,
      "end_seconds": 384
    },
    {
      "title": "Changing data types",
      "start_seconds": 384,
      "end_seconds": 449
    },
    {
      "title": "Removing duplicate entries",
      "start_seconds": 449,
      "end_seconds": 537
    }
  ],
  "thumbnail_urls": [
    "https://i.ytimg.com/vi/Ck0QgwiCEIs/hq720.jpg"
  ],
  "transcript_available": true,
  "fetched_at": "2026-10-02T06:00:37.743914+00:00",
  "fetch_tool": "yt-dlp 2026.08.19",
  "judged_ranges": [
    {
      "concept_id": "pandas.dtype_conversion",
      "start_seconds": 385,
      "end_seconds": 449,
      "verdict": "approved",
      "batch_id": "glossary_batch_001_data_analyst_pilot"
    }
  ]
}