{
  "video_id": "KFMs_ZZNgmo",
  "youtube_url": "https://www.youtube.com/watch?v=KFMs_ZZNgmo",
  "channel_id": "UC4SVo0Ue36XCfOyb5Lh1viQ",
  "title": "Matplotlib subplots in 6 minutes! \ud83d\udd32",
  "publish_date": "2025-10-07",
  "duration_seconds": 414,
  "language": "en-US",
  "playable_in_embed": true,
  "caption_tracks": [
    {
      "lang": "en-orig",
      "kind": "auto"
    },
    {
      "lang": "en",
      "kind": "auto"
    }
  ],
  "chapters": [
    {
      "title": "Introduction to subplots",
      "start_seconds": 0,
      "end_seconds": 68
    },
    {
      "title": "Configuring the figure",
      "start_seconds": 68,
      "end_seconds": 169
    },
    {
      "title": "Plotting top-left chart",
      "start_seconds": 169,
      "end_seconds": 256
    },
    {
      "title": "Plotting remaining charts",
      "start_seconds": 256,
      "end_seconds": 343
    },
    {
      "title": "Layout and finalizing",
      "start_seconds": 343,
      "end_seconds": 414
    }
  ],
  "thumbnail_urls": [
    "https://i.ytimg.com/vi/KFMs_ZZNgmo/maxresdefault.jpg"
  ],
  "transcript_available": true,
  "fetched_at": "2026-10-02T06:04:11.745263+00:00",
  "fetch_tool": "yt-dlp 2026.08.19",
  "judged_ranges": []
}