{
  "video_id": "wSFWJ0AF7SM",
  "youtube_url": "https://www.youtube.com/watch?v=wSFWJ0AF7SM",
  "channel_id": "UCiYjpuUaSfkvdZkmtDU7JRw",
  "title": "Data Analysis for BEGINNERS in Excel in 2025 | No Python Required",
  "publish_date": "2024-01-23",
  "duration_seconds": 819,
  "language": "en-US",
  "playable_in_embed": true,
  "caption_tracks": [
    {
      "lang": "en",
      "kind": "creator"
    },
    {
      "lang": "en-orig",
      "kind": "auto"
    },
    {
      "lang": "en",
      "kind": "auto"
    }
  ],
  "chapters": [
    {
      "title": "You don't need Python or R to analyze data",
      "start_seconds": 0,
      "end_seconds": 48
    },
    {
      "title": "Gathering and cleaning data with one tool",
      "start_seconds": 48,
      "end_seconds": 268
    },
    {
      "title": "If you want to improve your productivity",
      "start_seconds": 268,
      "end_seconds": 282
    },
    {
      "title": "Creating key statistics",
      "start_seconds": 282,
      "end_seconds": 493
    },
    {
      "title": "Analyzing data & creating a dashboard",
      "start_seconds": 493,
      "end_seconds": 595
    },
    {
      "title": "If you don't have the Analyze Data feature",
      "start_seconds": 595,
      "end_seconds": 643
    },
    {
      "title": "Analyzing data & creating a dashboard",
      "start_seconds": 643,
      "end_seconds": 819
    }
  ],
  "thumbnail_urls": [
    "https://i.ytimg.com/vi_webp/wSFWJ0AF7SM/maxresdefault.webp"
  ],
  "transcript_available": true,
  "fetched_at": "2026-10-02T06:27:44.832974+00:00",
  "fetch_tool": "yt-dlp 2026.08.19",
  "judged_ranges": []
}