{
  "video_id": "KEofcJ1tfkI",
  "youtube_url": "https://www.youtube.com/watch?v=KEofcJ1tfkI",
  "channel_id": "UCtYLUTtgS3k1Fg4y5tAhLbw",
  "title": "StatQuickie: Thresholds for Significance",
  "publish_date": "2017-02-22",
  "duration_seconds": 400,
  "language": "en",
  "playable_in_embed": true,
  "caption_tracks": [
    {
      "lang": "en-orig",
      "kind": "auto"
    },
    {
      "lang": "en",
      "kind": "auto"
    }
  ],
  "chapters": [
    {
      "title": "Introduction to Stat Quickies",
      "start_seconds": 0,
      "end_seconds": 41
    },
    {
      "title": "The 0.05 Threshold",
      "start_seconds": 41,
      "end_seconds": 131
    },
    {
      "title": "Exploratory Data Analysis",
      "start_seconds": 131,
      "end_seconds": 199
    },
    {
      "title": "Effect Size Matters",
      "start_seconds": 199,
      "end_seconds": 288
    },
    {
      "title": "Extraordinary Claims",
      "start_seconds": 288,
      "end_seconds": 400
    }
  ],
  "thumbnail_urls": [
    "https://i.ytimg.com/vi/KEofcJ1tfkI/mqdefault.jpg"
  ],
  "transcript_available": true,
  "fetched_at": "2026-10-02T06:04:03.094949+00:00",
  "fetch_tool": "yt-dlp 2026.08.19",
  "judged_ranges": []
}